"n0002_0000059","https://images-eu.ssl-images-amazon.com/images/I/31+ee4yTsqL._AC_US1150_.jpg","strawberry"
"n0001_0000109","https://images-eu.ssl-images-amazon.com/images/I/31-zXD6AT2L._AC_US1150_.jpg","Paul&Joe"
"n0001_0000110","https://images-eu.ssl-images-amazon.com/images/I/51-+mBF1xAL._AC_US1150_.jpg","sku281411 dancingnail 30 colors soak off pure jelly color nail art uv gel builder manicure"
"n0003_0000070","https://images-eu.ssl-images-amazon.com/images/I/61QWKsPVIcL._AC_US1150_.jpg","corum buckingham 157.171.20 steel mesh watch"
"n0001_0000111","http://gdimg.gmarket.co.kr/goods_image2/middle_jpgimg/112/642/1126422226.jpg","la splash lip couture retro bettie"
"n0008_0000002","https://images-na.ssl-images-amazon.com/images/I/61iuy8h4lOL._SY679_.jpg","infalab nick relief styptic powder"
"n0002_0000060","https://images-na.ssl-images-amazon.com/images/I/613Ye9oCcIL._SY679_.jpg","snow white dwarf masks"
"n0003_0000071","https://images-na.ssl-images-amazon.com/images/I/41qQahqmYZL.jpg","caprice hair spray"
"n0003_0000072","https://images-na.ssl-images-amazon.com/images/I/71KZymKz8PL._SX522_.jpg","john frieda brilliant brunette conditioner"
"n0001_0000112","https://images-eu.ssl-images-amazon.com/images/I/41ZS+kOQHAL._AC_US1150_.jpg","cover fx foundation"
"n0002_0000061","https://images-eu.ssl-images-amazon.com/images/I/31vRkDJsroL._AC_US1150_.jpg","cosmetics"
"n0008_0000003","https://images-na.ssl-images-amazon.com/images/I/51r7inzzKIL._SY679_.jpg","Safety razor"
"n0001_0000113","https://images-eu.ssl-images-amazon.com/images/I/41rt90PPhoL._AC_US1150_.jpg","flower forever wear liner long-wear eyeliner (fw5 - sapphire)"
"n0001_0000114","https://images-eu.ssl-images-amazon.com/images/I/317LcviVPAL._AC_US1150_.jpg","nail polish"
"n0003_0000073","https://images-na.ssl-images-amazon.com/images/I/41F8LrupC9L.jpg","biolage biolage rejuvatherapie conditioner, age rejuvenating - 8.5 fl oz"
"n0001_0000115","https://images-na.ssl-images-amazon.com/images/I/61DNS%2BBRNVL._SX522_.jpg","whisk, hatop kitchen premium silicone whisk with heat resistant non-stick silicone whisk cook"
"n0001_0000116","https://images-eu.ssl-images-amazon.com/images/I/51N2Xark2oL._AC_US1150_.jpg","shimmery metallic eye shadow"
"n0002_0000063","https://d10qoa1dy3vloz.cloudfront.net/resized/1200x1440/slots-img/wei/wei004_wei_lotusblossomthirstreliefsheetmask_1_780x980-ab9nl.jpg","wei sheet mask"
"n0001_0000118","https://images-eu.ssl-images-amazon.com/images/I/51FR8VqAmdL._AC_US1150_.jpg","lip smacker cola"
"n0001_0000119","https://images-eu.ssl-images-amazon.com/images/I/411Z3HnXwXL._AC_US1150_.jpg","guerlain 'ecrin 5 couleurs' eye shadow palette, 02 tonka imperiale"
"n0002_0000064","https://images-na.ssl-images-amazon.com/images/I/61FklXZiCvL._SX522_.jpg","water eye cream"
"n0003_0000074","https://images-eu.ssl-images-amazon.com/images/I/31DswvEtVwL._AC_US1150_.jpg","dr. mercola: revitalizing conditioner, 8 oz"
"n0005_0000029","https://images-eu.ssl-images-amazon.com/images/I/61Qlc8F2CwL._AC_US1150_.jpg","loreal crushed foil highlighter"
"n0001_0000120","https://images-eu.ssl-images-amazon.com/images/I/41A8U95iXbL._AC_US1150_.jpg","ads waterproof kajal pack of 1 and free kajal-uop"
"n0003_0000075","https://images-eu.ssl-images-amazon.com/images/I/318RfPcOHsL._AC_US1150_.jpg","umidificador foguete"
"n0005_0000030","http://pics.drugstore.com/prodimg/574133/500.jpg","me! bath bath bomb lavender lullaby 6 ct"
"n0001_0000121","https://images-eu.ssl-images-amazon.com/images/I/51-6q0K0W3L._AC_US1150_.jpg","cover fx pressed mineral foundation"
"n0004_0000031","https://images-eu.ssl-images-amazon.com/images/I/412iRkPnwkL._AC_US1150_.jpg","nike 150 blue fantasy gift set"
"n0003_0000076","https://images-na.ssl-images-amazon.com/images/I/71xHi6vzIxL._SY679_.jpg","chi color illuminate hair coloring conditioner"
"n0002_0000065","http://pics.drugstore.com/prodimg/589083/500.jpg","garnier skinactive clearly brighter argan nut gentle exfoliating cleanser"
"n0001_0000122","https://images-na.ssl-images-amazon.com/images/I/51AN5zya6aL._SX522_.jpg","born pretty 1 bottle 10ml soak off cat eye magnetic chameleon uv gel with magnet board #24"
"n0001_0000123","https://images-na.ssl-images-amazon.com/images/I/61XiybrKx7L._SX522_.jpg","opi red my fortune cookie"
"n0002_0000066","https://images-na.ssl-images-amazon.com/images/I/31MAbPdd9eL.jpg","ครีม ทา รอบ ดวงตา เกาหลี"
"n0005_0000032","https://images-eu.ssl-images-amazon.com/images/I/41rH0tLp5wL._AC_US1150_.jpg","Aluminium"
"n0001_0000124","http://gdimg.gmarket.co.kr/goods_image2/middle_jpgimg/696/764/696764158.jpg","skinfood skinfood mineral sugar triple shadow #03. yellow khaki"
"n0005_0000033","https://images-eu.ssl-images-amazon.com/images/I/41KUuKqFeZL._AC_US1150_.jpg","magideal 15 colors cream concealer highlight face contour foundation pallete set - 1"
"n0003_0000077","https://images-na.ssl-images-amazon.com/images/I/81vrKqSTwPL._SY679_.jpg","side part hairstyles with bangs"
"n0002_0000069","https://images-na.ssl-images-amazon.com/images/I/71neNKpKAaL._SX522_.jpg","eye liner"
"n0001_0000125","http://gdimg.gmarket.co.kr/goods_image2/middle_jpgimg/110/676/1106766486.jpg","lip gloss"
"n0002_0000070","https://images-eu.ssl-images-amazon.com/images/I/41Qpv1GLa6L._AC_US1150_.jpg","Aromablendz"
"n0001_0000126","https://images-na.ssl-images-amazon.com/images/I/51h7hpOOcqL.jpg","opi red gel polish"
"n0003_0000078","https://images-na.ssl-images-amazon.com/images/I/91faoaayx%2BL._SY679_.jpg","vatika hot oil treatment cream"
"n0003_0000079","https://images-na.ssl-images-amazon.com/images/I/71BO2aKjJAL._SY679_.jpg","redken blonde glam crystal flash1.7oz"
"n0002_0000071","https://images-na.ssl-images-amazon.com/images/I/61Ns-KUlynL._SX522_.jpg","marcelle bb cream golden glow"
"n0005_0000034","https://images-eu.ssl-images-amazon.com/images/I/31s0u3-FdJL._AC_US1150_.jpg","victoria secret lotion love spell"
"n0003_0000080","https://images-eu.ssl-images-amazon.com/images/I/21XMVZH6P8L._AC_US1150_.jpg","cosmetics"
"n0003_0000081","https://images-eu.ssl-images-amazon.com/images/I/41F4uh54qPL._AC_US1150_.jpg","schwarzkopf 9.5 1"
"n0004_0000032","https://images-eu.ssl-images-amazon.com/images/I/41kxaVTWwIL._AC_US1150_.jpg","home health herbal magic deodorant (herbal) 3 fl. oz."
"n0002_0000072","http://img14.360buyimg.com/n1/s546x546_jfs/t12082/236/198778135/132478/25b5c1b/5a05e3c2N3242fe74.jpg","Olay"
"n0002_0000073","https://images-eu.ssl-images-amazon.com/images/I/514LT7Q4byL._AC_US1150_.jpg","blue heaven facial kit"
"n0002_0000075","https://www.sephora.com/productimages/sku/s1627744-main-zoom.jpg","fresh sugar lip serum advanced therapy"
"n0002_0000076","https://images-eu.ssl-images-amazon.com/images/I/41cmvKJflrL._AC_US1150_.jpg","organic red raspberry seed oil"
"n0001_0000129","http://pics.drugstore.com/prodimg/572070/500.jpg","mascara rimmel super curler"
"n0002_0000077","https://www.sephora.com/productimages/sku/s1372713-main-zoom.jpg","laura mercier body butter, cr?me brulee, 6 oz, clear"
"n0001_0000130","https://images-na.ssl-images-amazon.com/images/I/41eBjj4CFGL.jpg","lipsense color sheer pink"
"n0004_0000034","https://images-eu.ssl-images-amazon.com/images/I/51xN87yoO+L._AC_US1150_.jpg","les nuits d'hadrien by annick goutal eau de toilette spray 3.4 oz (men)"
"n0002_0000078","https://images-eu.ssl-images-amazon.com/images/I/51tOspMYTQL._AC_US1150_.jpg","labello original classic care"
"n0003_0000084","https://images-na.ssl-images-amazon.com/images/I/41C0mbI8KJL.jpg","clairol professional liquicolor permanent 5aa/36d lightest ultra cool"
"n0004_0000035","https://images-eu.ssl-images-amazon.com/images/I/51vYRAG1IuL._AC_US1150_.jpg","bottle"
"n0005_0000035","https://images-eu.ssl-images-amazon.com/images/I/510OHnPBRcL._AC_US1150_.jpg","plastic bottle"
"n0005_0000036","https://images-eu.ssl-images-amazon.com/images/I/51yRlWlIo2L._AC_US1150_.jpg","phone cases from pink"
"n0001_0000131","https://images-eu.ssl-images-amazon.com/images/I/412DAf6kksL._AC_US1150_.jpg","clinique beyond perfect powder foundation concealer 11 honey"
"n0004_0000036","https://images-eu.ssl-images-amazon.com/images/I/41BEhX-B0aL._AC_US1150_.jpg","musk perfume for ladies"
"n0001_0000132","https://images-na.ssl-images-amazon.com/images/I/515SgVsWZCL._SX522_.jpg","Bait"
"n0004_0000037","https://images-eu.ssl-images-amazon.com/images/I/51pJmip52SL._AC_US1150_.jpg","rose infernale by terry"
"n0001_0000134","https://images-na.ssl-images-amazon.com/images/I/31kh2kz4glL.jpg","Lipstick"
"n0001_0000136","https://images-na.ssl-images-amazon.com/images/I/51etaFVuCSL._SX522_.jpg","lip gloss"
"n0001_0000137","https://images-eu.ssl-images-amazon.com/images/I/31vos4HKM8L._AC_US1150_.jpg","l'oreal paris visible lift blur blush, 501 soft peach, 0.6 fluid ounce 2 pack + free revlon age defying wrinkle remedy line filler"
"n0001_0000138","http://pics.drugstore.com/prodimg/259489/500.jpg","covergirl lashblast waterproof mascara"
"n0002_0000080","https://images-eu.ssl-images-amazon.com/images/I/51W7f-jGGqL._AC_US1150_.jpg","baby pink bb cream"
"n0007_0000005","https://images-eu.ssl-images-amazon.com/images/I/413Lk4HIDrL._AC_US1150_.jpg","Carrier oil"
"n0001_0000139","https://images-na.ssl-images-amazon.com/images/I/61knyzNyF6L.jpg","kylie mascara"
"n0003_0000086","https://images-eu.ssl-images-amazon.com/images/I/31V+5nnVQxL._AC_US1150_.jpg","missha first treatment essence"
"n0002_0000083","https://images-eu.ssl-images-amazon.com/images/I/61KfG5Er8BL._AC_US1150_.jpg","kleenex everyday facial tissues, 210 tissues per flat box"
"n0001_0000140","https://images-eu.ssl-images-amazon.com/images/I/61in5U0wz8L._AC_US1150_.jpg","Lip gloss"
"n0003_0000087","https://images-eu.ssl-images-amazon.com/images/I/41m3IwVcMnL._AC_US1150_.jpg","Hair"
"n0001_0000141","https://images-eu.ssl-images-amazon.com/images/I/418+YGi3ykL._AC_US1150_.jpg","urban decay bad blood"
"n0004_0000038","https://images-eu.ssl-images-amazon.com/images/I/41S13Nc4JCL._AC_US1150_.jpg","yardley english lavender talcum powder"
"n0001_0000142","https://images-eu.ssl-images-amazon.com/images/I/41AJ-1-SQGL._AC_US1150_.jpg","ikee design acrylic 4-shelf makeup organiser cosmetic palette display"
"n0003_0000088","https://images-eu.ssl-images-amazon.com/images/I/31CdaKwyFeL._AC_US1150_.jpg","pajamas"
"n0001_0000143","https://images-eu.ssl-images-amazon.com/images/I/51TCVaikaKL._AC_US1150_.jpg","concealer highlighter contour palette"
"n0004_0000039","https://b.cdnsbn.com/images/products/l/18519339506.jpg","Perfume"
"n0003_0000089","https://images-eu.ssl-images-amazon.com/images/I/41u5YV0kdJL._AC_US1150_.jpg","pro-techs anti hair loss treatment - conditioner shampoo 10oz and dropper 4oz."
"n0004_0000040","https://images-na.ssl-images-amazon.com/images/I/41EcZp3hzML.jpg","vera wang by vera wang edt spray ("
"n0001_0000145","https://images-eu.ssl-images-amazon.com/images/I/51I+o+ULUGL._AC_US1150_.jpg","do people still wear scrunchies"
"n0001_0000146","https://n.nordstrommedia.com/ImageGallery/store/product/Zoom/6/_101813726.jpg","bareminerals go nude or make a statement gift set"
"n0001_0000147","https://n.nordstrommedia.com/ImageGallery/store/product/Zoom/5/_100982265.jpg","colorescience bronzing perfector spf 20"
"n0005_0000037","https://n.nordstrommedia.com/ImageGallery/store/product/Zoom/7/_100375547.jpg","cocovit - 100% organic &amp; raw coconut oil"
"n0004_0000041","https://images-na.ssl-images-amazon.com/images/I/71jpJVCAKUL._SX522_.jpg","ari by ariana grande 3.4 oz edp spray for women"
"n0003_0000090","https://images-na.ssl-images-amazon.com/images/I/71pdh97La2L._SX522_.jpg","shea moisture superfruit complex 10-in-1 renewal system conditioner 380ml (pack of 2)"
"n0002_0000084","https://images-na.ssl-images-amazon.com/images/I/613IIL8GnsL._SX522_.jpg","elizavecca milky piggy hydro-gel bouncy eye patch mask (20ea)"
"n0005_0000038","https://images-eu.ssl-images-amazon.com/images/I/417jmBJtqeL._AC_US1150_.jpg","guerlain idylle shower gel 200ml/6.7oz"
"n0003_0000091","https://images-na.ssl-images-amazon.com/images/I/51uxIauia8L.jpg","shikai color reflect platinum shampoo 8 ounce tube"
"n0001_0000148","https://images-eu.ssl-images-amazon.com/images/I/41m-ussPTiL._AC_US1150_.jpg","eye shadow"
"n0005_0000039","http://pics.drugstore.com/prodimg/572496/500.jpg","palmer's coconut formula body cream"
"n0001_0000149","https://images-eu.ssl-images-amazon.com/images/I/41KKNwdBL8L._AC_US1150_.jpg","urban decay 24/7 glide-on eye pencil"
"n0002_0000085","https://images-eu.ssl-images-amazon.com/images/I/41dYHMtnA3L._AC_US1150_.jpg","ego sunsense anti ageing face"
"n0001_0000150","https://images-na.ssl-images-amazon.com/images/I/2149rJ9fYGL.jpg","revlon colorstay shadowlinks pearl eye shadow 300 onyx 0.05 oz"
"n0001_0000151","http://gdimg.gmarket.co.kr/goods_image2/middle_jpgimg/117/698/1176983508.jpg","ktown4u"
"n0003_0000092","https://images-na.ssl-images-amazon.com/images/I/61SUZuz-AkL._SX522_.jpg","piz-zaz hair building fibres all natural organic thickening system instantly conceal balding 0.98 oz in grey + fibre hold spray 120ml + gi"
"n0001_0000152","https://a.cdnsbn.com/images/products/l/12291084202.jpg","givenchy radically no surgetics age defying & perfecting foundation sp"
"n0001_0000153","http://gdimg.gmarket.co.kr/goods_image2/middle_jpgimg/970/730/970730441.jpg","lip concealer etude house"
"n0004_0000042","https://images-na.ssl-images-amazon.com/images/I/81g-pN1rkfL._SY679_.jpg","rochas eau fraiche eau de toilette 100 ml"
"n0003_0000093","https://images-na.ssl-images-amazon.com/images/I/41%2BhsYPO3UL.jpg","linha mediterraneo phebo-condicionador anti-frizz alfazema provencal 150 ml"
"n0007_0000006","https://images-eu.ssl-images-amazon.com/images/I/51y8JbAqTQL._AC_US1150_.jpg","バス セレブ 森林"
"n0003_0000094","https://images-eu.ssl-images-amazon.com/images/I/41K80sstDVL._AC_US1150_.jpg","galway hair gel"
"n0003_0000095","https://images-eu.ssl-images-amazon.com/images/I/51toYy3A-9L._AC_US1150_.jpg","matrix biolage hydratherapie aqua-immersion creme masque 5.1 oz"
"n0005_0000040","https://images-eu.ssl-images-amazon.com/images/I/41rJyAiKsYL._AC_US1150_.jpg","pure & basic pure and basic natural bath and body wash pomegranate ginger - 12 fl oz"
"n0005_0000041","https://images-eu.ssl-images-amazon.com/images/I/513s10F86kL._AC_US1150_.jpg","schizocarp indehiscent fruit"
"n0001_0000154","http://gdimg.gmarket.co.kr/goods_image2/middle_jpgimg/127/350/1273501193.jpg","Eye liner"
"n0002_0000086","https://images-eu.ssl-images-amazon.com/images/I/41+8moAMK-L._AC_US1150_.jpg","algenist overnight restorative cream"
"n0003_0000096","https://images-na.ssl-images-amazon.com/images/I/31LlMtODV7L.jpg","agadir argan oil shampoo and conditioner"
"n0003_0000097","https://www.sephora.com/productimages/sku/s1820257-main-zoom.jpg","devacurl light defining gel 12 oz"
"n0003_0000098","https://images-na.ssl-images-amazon.com/images/I/61hE211KvYL._SX522_.jpg","kms add volume liquid dust"
"n0001_0000155","https://images-na.ssl-images-amazon.com/images/I/51ZNc7%2BYoWL._SX522_.jpg","rouge bunny rouge colour burst lipstick- hues of enchantment - word"
"n0002_0000088","https://images-eu.ssl-images-amazon.com/images/I/41guC+EuN6L._AC_US1150_.jpg","oxyglow insta glow diamond bleach cream (pack"
"n0001_0000156","https://images-eu.ssl-images-amazon.com/images/I/016Q236MWPL._AC_US1150_.jpg","Makeup brush"
"n0002_0000089","https://images-na.ssl-images-amazon.com/images/I/71zDSltU64L._SY679_.jpg","cetaphil gentle skin cleanser"
"n0003_0000099","https://images-na.ssl-images-amazon.com/images/I/71hiEMNR0UL._SY679_.jpg","coal tar shampoo for psoriasis"
"n0003_0000100","https://images-na.ssl-images-amazon.com/images/I/312aSkpCZ1L.jpg","nexxus phyto organics chromalife firm hold shine spray 10.6 oz"
"n0001_0000157","https://a.cdnsbn.com/images/products/l/21636951114.jpg","eye shadow"
"n0001_0000158","https://images-na.ssl-images-amazon.com/images/I/714BoVxG3rL._SX522_.jpg","covergirl outlast nail daisy bloom"
"n0005_0000042","https://images-eu.ssl-images-amazon.com/images/I/41YbLcaGeTL._AC_US1150_.jpg","bath & body works signature collection travel size body lotion mad about you 3 fl oz / 88 ml"
"n0002_0000090","https://images-na.ssl-images-amazon.com/images/I/61GrLMhqyyL._SY679_.jpg","vitamin c serum artnaturals"
"n0001_0000159","https://images-na.ssl-images-amazon.com/images/I/61moj3l1CqL._S